{
  "meta": {
    "title": "XT30(2+2) SOLDERLESS HARNESS",
    "partNumber": "ALM-1233-01",
    "rev": "A",
    "date": "2026-07-13",
    "company": "ALMOND AI, INC.",
    "drawnBy": "AGENT",
    "sheet": "ANSI B"
  },
  "nodes": [
    {
      "id": "J1",
      "kind": "connector",
      "mpn": "XT30(2+2)-F.G.B",
      "description": "XT30(2+2) female, power + signal",
      "pins": [
        { "id": "1", "label": "BAT+" },
        { "id": "2", "label": "BAT-" },
        { "id": "S1", "label": "CAN_H" },
        { "id": "S2", "label": "CAN_L" }
      ]
    },
    {
      "id": "J2",
      "kind": "connector",
      "mpn": "XT30(2+2)-F.G.B",
      "description": "XT30(2+2) female, power + signal",
      "pins": [
        { "id": "1", "label": "BAT+" },
        { "id": "2", "label": "BAT-" },
        { "id": "S1", "label": "CAN_H" },
        { "id": "S2", "label": "CAN_L" }
      ]
    }
  ],
  "segments": [
    { "id": "SEG1", "from": "J1", "to": "J2", "lengthMm": 150, "covering": "pet-braid" }
  ],
  "wires": [
    { "id": "W1", "from": "J1.1", "to": "J2.1", "gauge": "18 AWG", "color": "red" },
    { "id": "W2", "from": "J1.2", "to": "J2.2", "gauge": "18 AWG", "color": "black" },
    { "id": "W3", "from": "J1.S1", "to": "J2.S1", "gauge": "24 AWG", "color": "yellow" },
    { "id": "W4", "from": "J1.S2", "to": "J2.S2", "gauge": "24 AWG", "color": "green" }
  ],
  "wireGroups": [{ "id": "TW1", "wires": ["W3", "W4"], "twisted": true }],
  "notes": [
    "CRIMP TERMINATIONS PER IPC/WHMA-A-620, NO SOLDER.",
    "MATES WITH XT30PW(2+2)-M.G.B RIGHT-ANGLE PCB HEADER (LCSC C19268030).",
    "POWER: 18 AWG SILICONE WIRE. SIGNAL: 24 AWG, TWISTED PAIR.",
    "OVERALL LENGTH 150 MM +/- 5 MM, CONTACT FACE TO CONTACT FACE."
  ]
}
